<?xml version="1.0" encoding="UTF-8"?>
<datetime xmlns="http://it.nure.ua/xmldemo"
	xmlns:xsi="http://www.w3.org/2001/XMLSchema-instance"
	xsi:schemaLocation="http://it.nure.ua/xmldemo datetime.xsd ">
	<Duration>P1M2D</Duration>
	<DateTime>2001-12-31T12:00:00</DateTime>
    <Time>10:00:00</Time>
	<YearMonth>2001-01</YearMonth>
	<MonthDay>--01-01</MonthDay>
	<Year>2001</Year>
	<Month>--01</Month>
<!--
    <Day>-&#45;&#45;12</Day>
    <DayOfWeek>-&#45;&#45;12</DayOfWeek>
    <DayOfWeek>-&#45;&#45;12</DayOfWeek>
    <DayOfWeek>-&#45;&#45;12</DayOfWeek>
-->

</datetime>
